{"evaluated_at":"2026-09-10T20:20:00Z","mappings":[{"awq_result":{"identifier":"ADAPTER-PYTHON-UNITTEST","kind":"adapter"},"claim":"bounded-equivalence-not-certification","correlation":{"configuration_sha256":"eeeeeeeeeeeeeeeeeeeeeeeeeeeeeeeeeeeeeeeeeeeeeeeeeeeeeeeeeeeeeeee","gate_definition_sha256":"dddddddddddddddddddddddddddddddddddddddddddddddddddddddddddddddd","input_sha256":"ffffffffffffffffffffffffffffffffffffffffffffffffffffffffffffffff","observation_set_id":"SET-PYTHON-20260910","platform_class":"native","reviewed_base":"cccccccccccccccccccccccccccccccccccccccc","source_commit":"aaaaaaaaaaaaaaaaaaaaaaaaaaaaaaaaaaaaaaaa","source_tree":"bbbbbbbbbbbbbbbbbbbbbbbbbbbbbbbbbbbbbbbb","tree_state":"clean"},"deadline_seconds":300,"evidence_class":"contract-test","id":"NATIVE-PYTHON","input_scope":"coordinator-python-tests","limitation":"A selected unit suite does not cover unselected integrations.","native_command":["python","-m","unittest","discover","-s","tests"],"requirement":"AWQ-PY-001","tier":"pr","tool_pin":{"name":"python","sha256":"4444444444444444444444444444444444444444444444444444444444444444","version":"3.13.15"}}],"observations":[{"identity":{"attempt":1,"collected_at":"2026-09-10T20:18:00Z","correlation_sha256":"e9e399546dedaf8aaa9971e8bd88e76468d5bcaf5f973de285ec3331737a45e2","evidence_class":"contract-test","evidence_sha256":"1111111111111111111111111111111111111111111111111111111111111111","freshness":{"max_age_seconds":600},"platform_class":"native","producer_sha256":"2222222222222222222222222222222222222222222222222222222222222222","run_id":"RUN-AWQ-20260910","schema_version":1,"tool_sha256":"3333333333333333333333333333333333333333333333333333333333333333"},"mapping":"NATIVE-PYTHON","source":"awq-adapter","status":"pass"},{"identity":{"attempt":2,"collected_at":"2026-09-10T20:19:00Z","correlation_sha256":"e9e399546dedaf8aaa9971e8bd88e76468d5bcaf5f973de285ec3331737a45e2","evidence_class":"contract-test","evidence_sha256":"4444444444444444444444444444444444444444444444444444444444444444","freshness":{"max_age_seconds":600},"platform_class":"native","producer_sha256":"5555555555555555555555555555555555555555555555555555555555555555","run_id":"RUN-NATIVE-20260910","schema_version":1,"tool_sha256":"4444444444444444444444444444444444444444444444444444444444444444"},"mapping":"NATIVE-PYTHON","source":"native-gate","status":"pass"}],"schema_version":2}
